[
  {
    "schema_version": "1.0.0",
    "source_id": "SRC-0001",
    "title": "Timbs v. Indiana, 586 U.S. 146 (2019) — full opinion (Cornell Legal Information Institute)",
    "author": "Supreme Court of the United States (opinion of the Court by Ginsburg, J.)",
    "organization": "Cornell Law School — Legal Information Institute",
    "publication_date": "2019-02-20",
    "accessed_at": "2026-06-20T00:00:00+00:00",
    "reference": "https://www.law.cornell.edu/supremecourt/text/17-1091",
    "source_type": "primary",
    "authority": 5,
    "directness": 5,
    "independence": 5,
    "recency": 5,
    "bias_or_interest": "Primary judicial record; Cornell LII is a neutral redistributor.",
    "relevant_locations": [
      "Syllabus",
      "Opinion of the Court (Ginsburg, J.)",
      "Concurrences (Gorsuch, J.; Thomas, J., in the judgment)"
    ],
    "quotation_note": "Public-domain U.S. government work; short attributed quotes are safe.",
    "rights_note": "Opinion text is public domain. Cite Cornell LII as the access source.",
    "content_hash": "sha256:f50ab22cd75e863273175746dbace13b9534ea036a28929cca35d7d589e11eac",
    "notes": "Primary opinion (No. 17-1091), 139 S.Ct. 682. Confirms 9-0, Feb 20 2019, Ginsburg; Excessive Fines Clause incorporated; ~$42,058 Land Rover; $10,000 max fine; vacated & remanded. Capture durable hash before publish."
  },
  {
    "schema_version": "1.0.0",
    "source_id": "SRC-0002",
    "title": "Timbs v. Indiana — Oyez case record",
    "author": null,
    "organization": "Oyez (IIT Chicago-Kent College of Law / Cornell LII / Justia)",
    "publication_date": null,
    "accessed_at": "2026-06-20T00:00:00+00:00",
    "reference": "https://www.oyez.org/cases/2018/17-1091",
    "source_type": "institutional",
    "authority": 4,
    "directness": 3,
    "independence": 4,
    "recency": 4,
    "bias_or_interest": "Educational legal database; secondary summary of the primary record.",
    "relevant_locations": [
      "Facts of the case",
      "Question",
      "Conclusion",
      "Vote (9-0)"
    ],
    "quotation_note": "Summarize; do not copy long passages.",
    "rights_note": "Metadata/summary reference only.",
    "content_hash": "sha256:c008149f8e9b18c80d7ee11a291988fe5279f4fdff4a0f5ce860eed52388b91f",
    "notes": "Cross-check for vote, date, procedural history, and the on-remand outcome (Timbs kept the vehicle)."
  },
  {
    "schema_version": "1.0.0",
    "source_id": "SRC-0003",
    "title": "Indiana Civil Forfeiture — Tyson Timbs case page (Institute for Justice)",
    "author": null,
    "organization": "Institute for Justice (IJ) — libertarian public-interest law firm; Timbs's counsel",
    "publication_date": null,
    "accessed_at": "2026-06-20T00:00:00+00:00",
    "reference": "https://ij.org/case/indiana-civil-forfeiture/",
    "source_type": "secondary",
    "authority": 3,
    "directness": 4,
    "independence": 2,
    "recency": 4,
    "bias_or_interest": "ADVOCACY: IJ represented Timbs and campaigns against civil forfeiture. Use only for attributed critique and case-background facts, never as neutral fact on the system.",
    "relevant_locations": [
      "Case facts (Timbs)",
      "How civil forfeiture works",
      "'Policing for profit' critique"
    ],
    "quotation_note": "Attribute explicitly ('the Institute for Justice argues'); do not state critique as undisputed fact.",
    "rights_note": "Summary/attribution reference only.",
    "content_hash": null,
    "notes": "Petitioner's counsel; advocacy source. Forfeiture-mechanics + 'policing for profit' framing must be attributed; defenders' view noted in script."
  },
  {
    "schema_version": "1.0.0",
    "source_id": "SRC-0004",
    "title": "There Is Bipartisan Agreement on the Uncivility of Civil Forfeiture (ACLU)",
    "author": null,
    "organization": "American Civil Liberties Union (ACLU)",
    "publication_date": null,
    "accessed_at": "2026-06-20T00:00:00+00:00",
    "reference": "https://www.aclu.org/news/criminal-law-reform/there-bipartisan-agreement-uncivility-civil",
    "source_type": "secondary",
    "authority": 3,
    "directness": 3,
    "independence": 2,
    "recency": 4,
    "bias_or_interest": "ADVOCACY (civil-liberties). Used only to support the neutral framing that criticism of civil forfeiture is bipartisan / spans the political spectrum.",
    "relevant_locations": [
      "Bipartisan criticism of civil forfeiture"
    ],
    "quotation_note": "Attribute; use for the 'bipartisan concern' framing only.",
    "rights_note": "Attribution reference only.",
    "content_hash": "sha256:e627714eddcf26a7e2c50d00444340409b135516e7cd676129a52b42d50af663",
    "notes": "Supports CLM that criticism is non-partisan / spans left and right (conservative groups + ACLU)."
  }
]