[
  {
    "schema_version": "1.0.0",
    "source_id": "SRC-0001",
    "title": "Lange v. California, 594 U.S. 295 (2021) — opinion (Cornell Legal Information Institute)",
    "author": "Supreme Court of the United States (opinion of the Court by Kagan, J.)",
    "organization": "Cornell Law School — Legal Information Institute",
    "publication_date": "2021-06-23",
    "accessed_at": "2026-06-20T00:00:00+00:00",
    "reference": "https://www.law.cornell.edu/supremecourt/text/20-18",
    "source_type": "primary",
    "authority": 5,
    "directness": 5,
    "independence": 5,
    "recency": 5,
    "bias_or_interest": "Primary judicial record; Cornell LII is a neutral redistributor.",
    "relevant_locations": [
      "Syllabus",
      "Opinion of the Court (Kagan, J.)",
      "Concurrences (Thomas; Kavanaugh; Roberts joined by Alito, in the judgment)"
    ],
    "quotation_note": "Public-domain U.S. government work; short attributed quotes are safe.",
    "rights_note": "Opinion text is public domain. Cite Cornell LII as the access source.",
    "content_hash": "sha256:89dbb4fcde0a1c228463bb22b5be5c9e8b97eb2808c5ec6dd94bea0a464990fc",
    "notes": "Primary opinion (No. 20-18). Confirms 9-0 in judgment (vacate & remand), Jun 23 2021, Kagan; no categorical misdemeanor-flight exigency; Roberts (+Alito) concurred in judgment favoring broader entry; Lange foot-under-garage-door facts."
  },
  {
    "schema_version": "1.0.0",
    "source_id": "SRC-0002",
    "title": "Lange v. California, 594 U.S. 295 (2021) — Justia case record",
    "author": null,
    "organization": "Justia",
    "publication_date": null,
    "accessed_at": "2026-06-20T00:00:00+00:00",
    "reference": "https://supreme.justia.com/cases/federal/us/594/20-18/",
    "source_type": "institutional",
    "authority": 4,
    "directness": 4,
    "independence": 4,
    "recency": 4,
    "bias_or_interest": "Primary opinion via neutral redistributor; full text + syllabus.",
    "relevant_locations": [
      "Syllabus",
      "Facts (Lange; loud music/honking; garage)",
      "Lineup / concurrences"
    ],
    "quotation_note": "Public-domain opinion; short attributed quotes safe.",
    "rights_note": "Opinion public domain.",
    "content_hash": null,
    "notes": "Cross-check the lineup (Kagan majority; Roberts+Alito concurring in judgment) and the facts."
  }
]